[
  {
    "payment_id": "PAY-0001",
    "invoice_id": "INV-2026-0001",
    "order_id": "300",
    "customer_id": "CUST-0001",
    "method": "card",
    "card_last4": "4242",
    "amount": "149.70",
    "currency": "EUR",
    "status": "captured",
    "paid_at": "2026-09-12T09:00:00Z",
    "attempted_at": "2026-09-12T09:00:00Z",
    "failure_reason": null
  },
  {
    "payment_id": "PAY-0002",
    "invoice_id": "INV-2026-0002",
    "order_id": "301",
    "customer_id": "CUST-0001",
    "method": "card",
    "card_last4": "4242",
    "amount": "45.00",
    "currency": "EUR",
    "status": "captured",
    "paid_at": "2026-09-02T09:00:00Z",
    "attempted_at": "2026-09-02T09:00:00Z",
    "failure_reason": null
  },
  {
    "payment_id": "PAY-0003",
    "invoice_id": "INV-2026-0003",
    "order_id": "302",
    "customer_id": "CUST-0001",
    "method": "card",
    "card_last4": "4242",
    "amount": "59.00",
    "currency": "EUR",
    "status": "captured",
    "paid_at": "2026-09-21T09:00:00Z",
    "attempted_at": "2026-09-21T09:00:00Z",
    "failure_reason": null
  },
  {
    "payment_id": "PAY-0004",
    "invoice_id": "INV-2026-0004",
    "order_id": "303",
    "customer_id": "CUST-0002",
    "method": "card",
    "card_last4": "1881",
    "amount": "289.00",
    "currency": "EUR",
    "status": "captured",
    "paid_at": "2026-09-05T09:00:00Z",
    "attempted_at": "2026-09-05T09:00:00Z",
    "failure_reason": null
  },
  {
    "payment_id": "PAY-0005",
    "invoice_id": "INV-2026-0005",
    "order_id": "304",
    "customer_id": "CUST-0002",
    "method": "card",
    "card_last4": "1881",
    "amount": "138.00",
    "currency": "EUR",
    "status": "captured",
    "paid_at": "2026-09-14T09:00:00Z",
    "attempted_at": "2026-09-14T09:00:00Z",
    "failure_reason": null
  },
  {
    "payment_id": "PAY-0006",
    "invoice_id": "INV-2026-0006",
    "order_id": "305",
    "customer_id": "CUST-0002",
    "method": "card",
    "card_last4": "1881",
    "amount": "349.00",
    "currency": "EUR",
    "status": "refunded",
    "paid_at": "2026-09-09T09:00:00Z",
    "attempted_at": "2026-09-09T09:00:00Z",
    "failure_reason": null
  },
  {
    "payment_id": "PAY-0007",
    "invoice_id": "INV-2026-0007",
    "order_id": "306",
    "customer_id": "CUST-0003",
    "method": "paypal",
    "card_last4": null,
    "amount": "219.00",
    "currency": "EUR",
    "status": "captured",
    "paid_at": "2026-09-01T09:00:00Z",
    "attempted_at": "2026-09-01T09:00:00Z",
    "failure_reason": null
  },
  {
    "payment_id": "PAY-0008",
    "invoice_id": "INV-2026-0008",
    "order_id": "307",
    "customer_id": "CUST-0003",
    "method": "paypal",
    "card_last4": null,
    "amount": "79.90",
    "currency": "EUR",
    "status": "captured",
    "paid_at": "2026-09-10T09:00:00Z",
    "attempted_at": "2026-09-10T09:00:00Z",
    "failure_reason": null
  },
  {
    "payment_id": "PAY-0009",
    "invoice_id": "INV-2026-0009",
    "order_id": "308",
    "customer_id": "CUST-0003",
    "method": "bank_transfer",
    "card_last4": null,
    "amount": "189.00",
    "currency": "EUR",
    "status": "pending",
    "paid_at": null,
    "attempted_at": "2026-09-19T09:00:00Z",
    "failure_reason": null
  },
  {
    "payment_id": "PAY-0010",
    "invoice_id": "INV-2026-0010",
    "order_id": "309",
    "customer_id": "CUST-0004",
    "method": "gift_card",
    "card_last4": null,
    "amount": "89.00",
    "currency": "EUR",
    "status": "refunded",
    "paid_at": "2026-09-03T09:00:00Z",
    "attempted_at": "2026-09-03T09:00:00Z",
    "failure_reason": null
  },
  {
    "payment_id": "PAY-0011",
    "invoice_id": "INV-2026-0011",
    "order_id": "310",
    "customer_id": "CUST-0004",
    "method": "gift_card",
    "card_last4": null,
    "amount": "199.00",
    "currency": "EUR",
    "status": "captured",
    "paid_at": "2026-08-26T09:00:00Z",
    "attempted_at": "2026-08-26T09:00:00Z",
    "failure_reason": null
  },
  {
    "payment_id": "PAY-0012",
    "invoice_id": "INV-2026-0012",
    "order_id": "311",
    "customer_id": "CUST-0004",
    "method": "gift_card",
    "card_last4": null,
    "amount": "119.00",
    "currency": "EUR",
    "status": "captured",
    "paid_at": "2026-09-20T09:00:00Z",
    "attempted_at": "2026-09-20T09:00:00Z",
    "failure_reason": null
  },
  {
    "payment_id": "PAY-0013",
    "invoice_id": "INV-2026-0013",
    "order_id": "312",
    "customer_id": "CUST-0005",
    "method": "card",
    "card_last4": "0005",
    "amount": "149.00",
    "currency": "EUR",
    "status": "captured",
    "paid_at": "2026-09-04T09:00:00Z",
    "attempted_at": "2026-09-04T09:00:00Z",
    "failure_reason": null
  },
  {
    "payment_id": "PAY-0014",
    "invoice_id": "INV-2026-0014",
    "order_id": "313",
    "customer_id": "CUST-0005",
    "method": "card",
    "card_last4": "0005",
    "amount": "57.70",
    "currency": "EUR",
    "status": "captured",
    "paid_at": "2026-09-08T09:00:00Z",
    "attempted_at": "2026-09-08T09:00:00Z",
    "failure_reason": null
  },
  {
    "payment_id": "PAY-0015",
    "invoice_id": null,
    "order_id": "314",
    "customer_id": "CUST-0005",
    "method": "card",
    "card_last4": "9999",
    "amount": "399.00",
    "currency": "EUR",
    "status": "failed",
    "paid_at": null,
    "attempted_at": "2026-09-22T09:00:00Z",
    "failure_reason": "Autorisation refusée par la banque émettrice."
  },
  {
    "payment_id": "PAY-0016",
    "invoice_id": "INV-2026-0016",
    "order_id": "315",
    "customer_id": "CUST-0006",
    "method": "bank_transfer",
    "card_last4": null,
    "amount": "89.00",
    "currency": "EUR",
    "status": "captured",
    "paid_at": "2026-09-06T09:00:00Z",
    "attempted_at": "2026-09-06T09:00:00Z",
    "failure_reason": null
  },
  {
    "payment_id": "PAY-0017",
    "invoice_id": "INV-2026-0017",
    "order_id": "316",
    "customer_id": "CUST-0006",
    "method": "bank_transfer",
    "card_last4": null,
    "amount": "159.00",
    "currency": "EUR",
    "status": "captured",
    "paid_at": "2026-09-18T09:00:00Z",
    "attempted_at": "2026-09-18T09:00:00Z",
    "failure_reason": null
  },
  {
    "payment_id": "PAY-0018",
    "invoice_id": "INV-2026-0018",
    "order_id": "317",
    "customer_id": "CUST-0006",
    "method": "bank_transfer",
    "card_last4": null,
    "amount": "29.80",
    "currency": "EUR",
    "status": "captured",
    "paid_at": "2026-09-16T09:00:00Z",
    "attempted_at": "2026-09-16T09:00:00Z",
    "failure_reason": null
  },
  {
    "payment_id": "PAY-0019",
    "invoice_id": "INV-2026-0019",
    "order_id": "318",
    "customer_id": "CUST-0002",
    "method": "card",
    "card_last4": "1881",
    "amount": "109.00",
    "currency": "EUR",
    "status": "captured",
    "paid_at": "2026-09-22T09:00:00Z",
    "attempted_at": "2026-09-22T09:00:00Z",
    "failure_reason": null
  },
  {
    "payment_id": "PAY-0020",
    "invoice_id": "INV-2026-0020",
    "order_id": "319",
    "customer_id": "CUST-0001",
    "method": "card",
    "card_last4": "4242",
    "amount": "29.90",
    "currency": "EUR",
    "status": "captured",
    "paid_at": "2026-08-29T09:00:00Z",
    "attempted_at": "2026-08-29T09:00:00Z",
    "failure_reason": null
  }
]
